content,anger,fear,joy,sadness,surprise
I have Dr. Wong.,0,0,0,0,0.0
"Hi, honey.",0,0,1,0,0.0
Virus is secure.,0,0,0,0,0.0
I can't remove the vest without triggering it.,0,0,0,0,0.0
We need that detonator.,0,0,0,0,0.0
You better kill me now.,1,0,0,0,0.0
I have the detonator.,0,0,0,0,0.0
Looks like I'm not the only one who needed backup.,0,0,0,0,0.0
Tatsu's resting in the infirmary.,0,0,0,0,0.0
"She'll be in pain for a few days, but she'll be fine.",0,0,0,0,0.0
She would have been dead if you hadn't have come back and fought with us.,0,0,0,0,0.0
"I don't know if I'll ever get over what happened on Earth-2, but I'll help you make sure it never happens again.",0,0,0,0,0.0
In a secure location.,0,0,0,0,0.0
"The virus is, too.",0,0,0,0,0.0
"And so what-- what, do we text the Monitor or whatever, letting him know we have his guy?",0,0,0,0,0.0
Don't think he texts.,0,0,0,0,0.0
I don't want to hand over Dr. Wong just yet.,0,0,0,0,0.0
"I want answers, and if he is not gonna give them to me,",0,0,0,0,0.0
I'm gonna find them somewhere else.,0,0,0,0,0.0
"Oliver, what are you talking about?",0,0,0,0,0.0
Tatsu... she told me that I had to be absolutely sure that I was making the right choice.,0,0,0,0,0.0
"She almost died, John.",1,0,0,0,0.0
A lot of people have died already for the sake of this mission.,1,0,0,1,0.0
I owe it to all of them to find out who The Monitor really is.,0,0,0,0,0.0
"And, Oliver, what if we don't like the answers to those questions?",0,0,0,0,0.0
What do we do then?,0,0,0,0,0.0
We find another way to stop it.,0,0,0,0,0.0
There's always another way.,0,0,0,0,0.0
"Oliver, so what's the plan?",0,0,0,0,0.0
I need to apologize to a friend of mine first.,0,0,0,0,0.0
So...what do you say?,0,0,0,0,0.0
How about you and me leave together?,0,0,0,0,0.0
"It was a nice speech, but once again, you have managed to make everything about you.",0,0,1,0,0.0
This isn't about you or dad.,0,0,0,0,0.0
"Yeah. You both have this misguided idea about duty and family, civic pride.",1,0,0,0,0.0
You fail to see the bigger picture.,1,0,0,0,0.0
I have vision.,0,0,0,0,0.0
What are you talking about?,0,0,0,0,0.0
Did you really not think that I knew you'd show up here?,1,0,0,0,0.0
"Yes. Worthless piece of junk, my ass.",1,0,0,0,0.0
What the hell did the Deathstrokes want with this?,1,0,0,0,0.0
What did you do?,1,0,0,0,0.0
What did you do?!,1,0,0,0,0.0
"Oh. Hey, hey. I knew that you thought that I'd be after the valuables in Vasquez's safe and that Zoe would lead you here, the one shady trading post that she knows about, right?",0,0,0,0,0.0
You were never after the money.,0,0,0,0,0.0
Why cripple the system when you can rip its heart out?,0,0,0,0,1.0
"Oh, my god.",0,0,1,0,0.0
"Once the unification movement is gone, the power vacuum is ours to fill.",0,0,1,0,0.0
I think we're done here.,0,0,1,0,0.0
Not even close.,1,0,0,0,0.0
You are not gonna touch me.,0,0,0,0,0.0
"Oh, yeah? And why is that?",0,0,0,0,1.0
"Because if you do, the men who are storming your bunker right now will kill your brother.",0,0,0,0,0.0
"William, do you copy?",0,0,0,0,0.0
"Like I said, I think we're done here.",0,0,0,0,0.0
"If you hurt my brother, I swear I will kill you.",1,0,0,0,0.0
JJ...please.,0,1,0,0,0.0
"You were wrong about me, brother.",1,0,0,0,0.0
It was never a mask.,1,0,0,0,0.0
Think the doctors would have preferred you stay in the hospital.,0,0,0,0,0.0
I have survived worse.,0,0,1,0,0.0
Brought you something. - Herbs. - There's a rumor going around they help with healing.,0,0,0,0,0.0
I have seen many battles.,0,0,0,0,0.0
"For a moment, I believed this was my last.",0,0,0,0,0.0
"I saw Akio and Maseo,",0,0,0,0,0.0
But...this was not my time.,0,0,0,0,0.0
"Tatsu, you almost died because of me.",0,1,0,1,0.0
I'm sorry.,0,0,0,1,0.0
"Well, you were right when you said that some missions aren't worth the cost, so I'm gonna make sure that this one is.",0,0,0,0,0.0
So where will you go?,0,0,0,0,0.0
You heard a rumor about The Monitor and a coming crisis?,0,0,0,0,0.0
I doubt the Crescent Order will have the answers you seek.,0,0,0,0,0.0
"Thankfully, there are organizations on this earth far, far older than the Crescent Order.",0,0,1,0,0.0
I'm going to Nanda Parbat.,0,0,0,0,0.0
You should have told me what was going to happen on earth-2.,0,0,0,0,0.0
John was there. He could have been killed.,0,0,0,1,0.0
The destruction of that earth was a necessary sacrifice.,0,0,0,1,0.0
And what about Laurel Lance?,0,0,0,0,0.0
"Her friends, her family--Countless more like them will perish if we do not ensure that Oliver Queen is prepared for what is coming.",0,1,0,1,0.0
Were you successful?,0,0,0,0,0.0
Yes. I have Dr. Wong.,0,0,1,0,0.0
"Previously on The Flash""...""",0,0,0,0,0.0
My cure will work.,0,0,1,0,0.0
Or turn them into meta-humans.,0,0,1,0,0.0
"Beginning biopsy examination on Patient 1-A, Mitch Romero.",0,0,0,0,0.0
I want to become a defense attorney for meta-humans.,0,0,0,0,0.0
"Babe, do you know how many people you could help in this city?",0,0,1,0,0.0
"Hi, I'm here about the internship.",0,0,1,0,0.0
"Welcome to The Citizen.""""",0,0,1,0,0.0
"In order for billions to survive, the Flash must die.",0,0,0,0,0.0
I'm gonna go see this Crisis for myself.,0,0,0,1,0.0
The only timeline where you all survived was if I died.,0,0,0,1,0.0
So what do we tell them?,0,0,0,0,1.0
"Whatever we're gonna do, we can't tell the team I'm gonna die.",0,0,0,1,0.0
"Add all these to the inventory, boys.",0,0,1,0,0.0
Tomorrow's bake sale is gonna be a real treat.,0,0,1,0,0.0
Who died and made you boss?,0,0,0,0,0.0
Mitch Romero.,0,0,0,0,0.0
Still no word from him?,0,0,0,1,0.0
"That makes Romero missing, not dead.",0,0,0,1,0.0
"In our line of work, what's the difference?",0,0,0,0,1.0
This is my crew now.,0,0,0,0,0.0
"Fan out. Whoever's here, put him down.",1,0,0,0,0.0
Romero?,0,0,0,0,0.0
The Monitor?,0,0,0,0,1.0
Where did you see him?,0,0,0,0,1.0
"We went in the Time Vault, right after putting Chester in the MAC.",0,0,0,0,0.0
"The Crisis that he spoke about last year, it's the same one in the plinth's newspaper.",0,0,0,0,0.0
And it's not coming in 2024.,0,0,0,0,0.0
It's coming December 10th... 2019. - Are you sure about this? - The jackass lied to you.,1,0,0,0,0.0
"Yeah, well, we thought so, too, but...",0,0,0,0,0.0
"Barry went to Earth-3, and Jay Garrick helped him see that it was true.",0,0,0,0,0.0
How did he do that?,0,0,0,0,1.0
Jay projected my mind forward into the future.,0,0,0,0,0.0
Okay. And what did you see?,0,0,0,0,1.0
I saw a giant wave of anti-matter sweeping over our Earth.,0,1,0,0,0.0
Vaporized all of Central City and everybody in it.,0,1,0,1,0.0
Including you three.,0,0,0,0,0.0
Great. I'll go mark my calendar.,0,0,1,0,0.0
We still have seven weeks to make sure none of this happens.,0,1,0,1,0.0
"Guys, Barry's right.",0,0,1,0,0.0
We've changed the future before.,0,0,1,0,0.0
We can change it again.,0,0,1,0,0.0
So what else did our Asgardian cosplayer say?,0,0,0,0,1.0
That was pretty much it.,0,0,0,0,0.0
It's Joe.,0,0,0,0,0.0
"Needs me at CCPD, but that can wait.",0,0,0,0,0.0
We--we need to get on this.,0,0,0,0,0.0
"Yeah, we should spend every minute we have on this.",0,0,0,0,0.0
"No, guys, look, what we should do is take a well-deserved time-out and come back tomorrow with clear heads.",0,0,1,0,0.0
Okay. If you think so.,0,0,1,0,0.0
What now?,0,0,0,0,1.0
I have to prepare them for what's coming.,0,0,0,0,0.0
They have to be ready to go on without me.,0,0,0,1,0.0
I guess I know who I need to start with.,0,0,1,0,0.0
Mom?,0,0,1,0,1.0
Ralphy!,0,0,0,0,1.0
"Ralph, oh, come here, baby. - Those stupid things. - What happened?",0,0,0,1,1.0
"Last night, 10:00 p.M., the Avenue M pawn shop was robbed at gunpoint.",1,0,0,1,0.0
"The shop owner ID'd your mom as the perp, so we had to hold her.",0,0,0,1,0.0
Charges pending.,0,0,0,0,0.0
"Mrs. Dibny, this is Cecile Horton.",0,0,0,0,0.0
Ralph.,0,0,0,0,0.0
Good luck.,0,0,1,0,0.0
"Look, Cecile, yes, my mom has an eventful past, but...",0,0,0,0,0.0
"Okay, robbery, larceny, bribery... 14 allegations.",1,0,0,1,0.0
"Not a single charge, Miss Perfect Hemline.",0,0,0,1,0.0
Thank you. Um...,0,0,1,0,0.0
"Ooh, it says here that the owner of the pawn shop personally identified you as the robber.",0,0,0,1,0.0
"Okay, I was in the shop, but not at 10:00.",0,0,0,0,0.0
I left around 5:00.,0,0,0,0,0.0
"Okay, so the robbery was, like, five hours later, so, Mom, where were you around 10:00?",0,0,0,0,1.0
Is it really that important?,0,0,0,0,1.0
"Wait, yesterday was the second Monday of the month, so, Mom...",0,0,0,0,0.0
I was at the Cleaner's Royale on Oak.,0,0,0,0,0.0
"Okay, dry cleaners.",0,0,0,0,0.0
It's a little bit of a gambling front.,0,0,0,1,0.0
"Wow, Mom, the last time that I was there was when... when you and Marv Perez were an item.",0,0,0,0,0.0
May he rest in peace.,0,0,0,1,0.0
"Well, Ralphy, I really don't think anyone there is gonna help with my alibi.",0,0,0,1,0.0
There's only one way to find out.,0,0,0,0,0.0
Road trip.,0,0,0,0,0.0
"Joe thinks there's a meta-killer that might be involved, so if anybody asks, you're my meta-human consultant.",0,0,0,0,0.0
The security guard from a nearby building heard the gunshots.,0,0,0,1,0.0
Said it sounded like a war zone.,0,1,0,1,0.0
We haven't found enough body parts to determine which crew did all this.,0,0,0,1,0.0
He's covered in claw marks.,0,0,0,1,0.0
An animal did this. Good to go?,0,0,1,0,0.0
"No, we're not. This--this isn't animal blood.",1,0,0,1,0.0
"There's two more bodies, or what's left of them, and a lot more of whatever that is.",0,0,0,1,0.0
"I see one arm, two arms.",0,0,0,0,0.0
Hm. They're from the same person.,0,0,0,0,0.0
I'll analyze this.,0,0,0,0,0.0
"Hopefully, it'll lead us to our killer.",0,0,1,0,0.0
Thank you.,0,0,1,0,0.0
Can you analyze what's going on with her?,0,0,0,0,0.0
"Yeah, I'm trying.",0,0,0,0,0.0
"Frost! Frost, what are you doing?",0,0,0,0,1.0
There's no ammo in these.,0,0,0,0,0.0
I know these guns.,0,0,1,0,0.0
They're charged with dark matter.,0,0,0,0,0.0
They're all empty.,0,0,0,0,0.0
Who would kill for dark matter?,0,0,0,0,1.0
A coward.,1,0,0,0,0.0
Gotcha.,0,0,0,0,0.0
What did you do?,0,0,0,0,1.0
"Frost, what are you doing?",0,0,0,0,1.0
"You're supposed to be following my lead, not--",1,0,0,0,0.0
Getting a damn murderer to confess?,0,0,0,0,1.0
There's no evidence he's involved.,0,0,0,0,0.0
Ease up.,0,0,0,0,0.0
Let him go.,0,0,0,0,0.0
Cait?,0,0,0,0,0.0
You're Killer Frost?,0,0,0,0,1.0
"Actually, she's me, Sad Coffee Guy.",0,0,0,1,0.0
I am so sorry. My name is Barry Allen.,0,0,0,1,0.0
I'm a forensic scientist with CCPD.,0,0,0,0,0.0
"We're investigating a series of meta-related murders, and Caitlin and Frost are my meta-human consultants.",0,0,0,0,0.0
Dr. Ramsey Rosso.,0,0,0,0,0.0
What happened to your lab?,0,0,0,0,1.0
"Um, somebody broke in while I was working late.",0,1,0,0,0.0
This same substance was at our crime scene.,0,0,0,0,0.0
I think the meta that attacked you is the person we're looking for.,0,0,0,0,0.0
The guy we're looking for stole dark matter from a stash house.,1,0,0,0,0.0
I did have a small amount of dark matter here. - Where'd you get it from? - From an old colleague.,0,0,0,0,1.0
Ted Kord.,0,0,0,0,0.0
He was actually willing to help me with my research.,0,0,1,0,0.0
"Well, someone's out there hunting for dark matter, and he's willing to kill to get it.",1,0,0,0,0.0
So whatever it is you're working on--,0,0,0,0,0.0
"Look, Mr. Allen, my HLH research is very important.",1,0,0,0,0.0
I lost my mother to this disease.,0,0,0,1,0.0
"Now, you mentioned you found a similar substance, both here and at your crime scene.",0,0,0,0,0.0
"And, honestly, it's unlike anything I've seen before.",0,0,0,0,0.0
"Well, I am a blood specialist.",0,0,0,0,0.0
Perhaps I could be of some assistance.,0,0,1,0,0.0
"You are not actually gonna trust this guy, are you? - 'Cause I don't. - I'm sorry.",0,0,0,1,1.0
Frost...,0,0,0,0,0.0
"People are dying out there, all right?",1,0,0,0,0.0
"If Dr. Rosso can help us in any way, then, yeah, I'm open to it, and you should be, too.",0,0,1,0,0.0
"Would you help us, Dr. Rosso?",0,0,0,0,1.0
"Please, call me Ramsey.",1,0,0,0,0.0
"Morning, boss.",0,0,1,0,0.0
"I have got the mother of all scoops, and thanks to your new intern, it's gonna be a CCC Media exclusive.",0,0,1,0,0.0
"Actually, you know, I was hoping that you would help me with the new filing system.",0,0,0,0,0.0
Alphabetical is great.,0,0,1,0,0.0
So there was a break-in at McCulloch Tech last night.,0,0,0,1,0.0
"Nothing was stolen, but you'll never guess who the perp is.",0,0,0,0,1.0
Get this. Harrison Wells is alive.,0,0,1,0,1.0
Where'd you get this?,0,0,0,0,1.0
One of the McCulloch security guards and I go way back.,0,0,0,0,0.0
Nice work.,0,0,1,0,0.0
"Um, I'll tell you what.",0,0,0,0,0.0
"I will look into this, and in the meantime,",0,0,0,0,0.0
I could use some quotes on that mayor story.,0,0,0,0,0.0
The city council's wondering how long this new one's gonna last.,0,0,0,0,0.0
Uh...I'd rather do this.,0,0,0,0,0.0
"Allegra, look, I understand, okay?",1,0,0,0,0.0
"I was an ambitious cub reporter once, too.",0,0,0,0,0.0
"You know, this is great work, but I will take it from here, okay?",0,0,1,0,0.0
Fine.,0,0,1,0,0.0
Ralphy boy!,0,0,0,0,1.0
"Long time no see. - Looking trim. - Thanks, Tony. - Deb. - Howdy, Tone-Loc.",0,0,1,0,0.0
"I need a favor, Tony",0,0,0,0,0.0
"Yeah, hi, the Avenue M pawn shop was robbed last night, and the police think that Debbie was responsible.",0,0,0,1,0.0
We just need the footage from your security camera so we can prove that Mom was here last night.,0,0,0,0,0.0
"Last night? Yeah, Deb was here.",0,0,0,0,1.0
Great.,0,0,1,0,0.0
But I don't work with the cops.,0,0,0,0,0.0
House policy.,0,0,0,0,0.0
"Besides, you know I don't have cameras in here, Deb. - Potted plant. - Ugly lamp on the bar.",0,0,0,1,0.0
"Smoke detectors one, two, three.",0,0,0,0,0.0
"I like you, Ralphy. Guess what? - You can have the footage. - Oh, great. - For 5,000 bucks. - I'm sorry, what?",0,0,1,0,0.0
Come back and see me when you got the green.,0,0,0,0,0.0
"Good to see you, Ralphy boy.",0,0,1,0,0.0
That was a bust.,0,0,0,1,0.0
"Oh, well.",0,0,0,0,0.0
"Wait, wait, wait, hang on, hang on, hang on, Mom.",0,1,0,0,0.0
"We might not got the green. We can earn it. - Right. - Uh, excuse me, down here.",0,0,1,0,0.0
How exactly are we going to earn it?,0,0,0,0,1.0
"Watch me, sweetie.",0,0,1,0,0.0
So can I talk to Cait?,0,0,0,0,1.0
Can she hear me right now?,0,0,0,0,1.0
"One, it's Frost. I'm rebranding.",0,0,0,0,0.0
"And two, sure. She can if she wants to.",0,0,0,0,0.0
"Caitlin, I want to explain myself.",0,0,1,0,0.0
About purchasing dark matter from Kord Industries.,0,0,0,0,0.0
I hope you understand if there's any chance of saving more lives...,0,0,0,1,0.0
You're gonna take it. Right.,0,0,1,0,0.0
"I didn't want to go behind your back, but you refused to help me.",1,0,0,1,0.0
Not listening anymore.,0,0,0,1,0.0
And you never told me that you were a meta.,0,0,0,1,1.0
"I thought we were closer than that, Cait.",0,0,1,0,0.0
Huh. Guess you two aren't as good of friends as you thought.,0,0,0,1,0.0
"Hey, guys, CCPD got back a DNA match on our meta.",0,0,0,0,0.0
Mitch Romero. - Do you recognize the name? - No.,0,0,0,0,0.0
Mitch Romero is the head of Central City's biggest gun-running operation.,0,0,0,0,0.0
What? I have friends in low places.,0,0,0,0,0.0
Romero must've been looking for dark matter last night when he went to the only place he knew he'd find it.,0,0,0,0,0.0
His own stash.,0,0,0,0,0.0
Why rob yourself and then kill all your employees?,0,0,0,1,1.0
Someone just broke into Mercury Labs.,0,0,0,1,0.0
A facility like that would have undisclosed amounts of dark matter.,0,0,0,1,0.0
What did you do?,0,0,0,0,1.0
What did you do? Frost!,1,0,0,0,1.0
You just killed him!,1,0,0,1,1.0
"We're supposed to cuff metas, not throw them out windows.",1,0,0,1,0.0
Calm down.,0,0,0,0,0.0
Romero is fine. He just got up and walked away.,0,0,0,0,0.0
You had no idea that would happen when you shot him out the window.,1,0,0,0,0.0
You let your anger get the better of you,0,0,0,1,0.0
I thought you had a handle on that.,0,0,0,1,0.0
Frost! That cannot happen again.,0,0,0,1,0.0
"What, now you're telling me how to feel?",0,0,0,0,1.0
"Look, I have seven weeks to teach you how to handle this kind of situation.",0,0,0,0,0.0
You have to start listening.,1,0,0,0,0.0
You have to stop being such a crappy teacher.,1,0,0,1,0.0
Make sure she loses.,0,0,0,0,0.0
Tony's security footage is on a USB drive in his office.,0,0,0,0,0.0
Buy me as much time as you can.,0,0,1,0,0.0
"Okay, it's fine. We got it. Go.",0,0,1,0,0.0
Okay.,0,0,1,0,0.0
He's nervous.,0,0,0,1,0.0
Go. Do it.,0,0,1,0,0.0
Pair of tens.,0,0,0,0,0.0
Can't bluff a bluffer.,1,0,0,0,0.0
Boom.,0,0,0,0,0.0
You're kidding me.,1,0,0,0,1.0
Debbie's hot tonight.,0,0,1,0,0.0
"Uh, Debbie. Oh, Deb.",0,0,0,0,0.0
All in.,0,0,0,0,0.0
Read 'em and weep.,0,0,0,0,0.0
"Ooh, tough break, Deb.",0,0,0,1,0.0
"I'm sorry, Mom. We tried.",0,0,0,1,0.0
"Let's get you home. Good to see you, Tony.",0,0,1,0,0.0
Keep up the not-so-legal work.,0,0,0,0,0.0
Where's Killer Caitlin?,0,0,0,0,1.0
Out assaulting another suspect without cause?,0,0,0,0,1.0
She's taking a breather.,0,0,0,0,0.0
Did you find anything helpful from the sample?,0,0,0,0,1.0
More than I ever imagined.,0,0,0,0,1.0
Take a look at the pattern of these gene transcriptions.,0,0,0,0,0.0
Romero's dark matter-infused cells are destroying his normal cells.,0,0,0,1,0.0
He's more monster now than man.,0,0,0,0,1.0
"The more dark matter he absorbs, the stronger he gets.",0,0,1,0,0.0
"According to this,",0,0,0,0,0.0
Romero's been dead for over 24 hours.,0,0,0,1,0.0
That's why he can't die.,0,0,0,1,0.0
He already has.,0,0,0,0,0.0
"Um, thank you for your help, Dr. Rosso. - Barry. - Yeah?",0,0,1,0,0.0
"If I could observe Romero's genes interacting with dark matter,",0,0,0,0,0.0
I might be able to find a way to counteract his condition.,0,0,0,0,0.0
I don't think that's a good idea.,0,0,0,1,0.0
Working with dark matter can be really dangerous.,0,1,0,0,0.0
"Mr. Allen, I'm the top hematologic oncologist in the western hemisphere.",0,0,0,0,0.0
"There's a creature out there with a metastasized blood chemistry with the strength of ten men, and he's getting stronger by the minute.",0,0,0,0,1.0
"Please, let me help.",0,0,1,0,0.0
The satellite's facial recognition spotted our new Wells less than an hour ago.,0,0,0,0,0.0
"According to Miranda, it's somewhere in this area.",0,0,0,0,0.0
"Harrison Wells, welcome to Earth-1.",0,0,1,0,0.0
My name is Cisco Ramon.,0,0,0,0,0.0
Why are you following me?,0,0,0,0,1.0
"Oh, great. Another angry one.",0,0,0,0,0.0
To get your hands on this priceless beauty?,0,0,0,0,1.0
Is that why? Go ahead.,0,0,0,0,1.0
It gives nightmare hallucinations to all of its victims.,0,1,0,1,0.0
Would you like that? - Would you like that? - No!,0,0,0,0,0.0
So... - It's you. - What? - What's your name? - Iris West-Allen.,0,0,0,0,0.0
"Well, Iris--",0,0,0,0,0.0
And don't you forget it.,0,0,0,0,0.0
I had that.,0,0,0,0,0.0
And there you are.,0,0,0,0,0.0
"Wait. Oh, no, no, no.",0,1,0,0,0.0
"Debbie, um... that has you leaving at 9:30.",0,0,0,0,0.0
"We need to know where you were at 10:00, the exact time of the robbery.",0,0,0,0,0.0
"Went out for air. Oh, well. We tried.",0,0,0,0,0.0
"Hang on, there's another camera angle outside.",0,0,0,0,0.0
"Ralphy, don't...",0,0,0,0,0.0
Did you find her?,0,0,0,0,1.0
I did.,0,0,1,0,0.0
With Marv Perez.,0,0,0,0,0.0
Marv's alive?,0,0,0,0,1.0
Yeah.,0,0,0,0,0.0
You said he died in a car accident months ago.,0,0,0,1,0.0
You were with...,0,0,0,0,0.0
Marv when the pawn shop was robbed.,0,0,0,0,0.0
"Ralphy, let me explain.",0,1,0,0,0.0
"If Marv is alive, what about your other boyfriends?",0,0,1,0,0.0
How many of them are alive?,0,0,0,0,1.0
Okay. All of them.,0,0,0,0,0.0
"Ralph, hey, you know what? It's okay.",0,0,1,0,0.0
"This is-- this is a good thing because Marv is Debbie's alibi, so your mom isn't gonna go to jail.",0,0,1,0,0.0
"Yeah, let's focus on that.",0,0,1,0,0.0
"Marv, Doug, Craig, Nick? These guys, they...",0,0,0,0,0.0
They were like family to me.,0,0,1,0,0.0
How could you lie about that?,1,0,0,0,1.0
"I don't know why you're so upset, sweetie.",0,0,0,1,1.0
You always moved on so quickly.,0,0,0,0,0.0
I was being strong for you.,0,0,1,0,0.0
That doesn't mean it didn't hurt like hell every damn time. - What really happened? - What always happens.,0,0,0,0,1.0
"You know, we were happy, but I knew it wouldn't last, so I ended it.",0,0,1,0,0.0
What else did you lie about? - Did Dad really leave us? - Yes.,1,0,0,1,0.0
That one is true.,0,0,0,0,0.0
"Ralphy, I didn't mean to hurt you.",0,1,0,1,0.0
My name is Ralph.,0,0,0,0,0.0
You need to leave.,0,0,0,0,0.0
Get out.,1,0,0,0,0.0
Now.,0,0,0,0,0.0
I can't believe you and Cait get to work here.,0,0,0,0,1.0
How will all this help?,0,0,0,0,1.0
Dark matter is a miraculous thing.,0,0,0,0,1.0
"With gene splicing, I can use your dark matter samples to negatively charge Romero's blood.",0,0,0,0,0.0
That should weaken him enough for you to make an arrest.,0,0,0,0,0.0
"But, um...",0,0,0,0,0.0
"I, uh...",0,0,0,0,0.0
I will need a second centrifuge.,0,0,0,0,0.0
"Oh. Uh, there's another one downstairs.",0,0,0,0,1.0
I'll get it.,0,0,1,0,0.0
I had a feeling about you.,0,0,1,0,0.0
I hoped I was wrong.,0,0,0,1,0.0
But I know a desperate man when I see one.,0,0,0,0,0.0
Put them back. - No. - I can make you.,0,0,0,0,0.0
"Go on, then.",0,0,0,0,0.0
"Like you said, I'm a desperate man.",0,0,0,1,0.0
I have nothing to lose.,0,0,0,1,0.0
I thought you wanted to save lives.,0,0,1,0,0.0
HLH isn't just my mother's disease.,0,0,0,1,0.0
"First it killed her, and now it's killing me.",1,1,0,1,0.0
I still can't let you take those.,0,0,0,1,0.0
Look at what it did to Mitch Romero.,0,0,0,0,0.0
"I am marking a calendar every day until I die, waiting to fall off a cliff, powerless to grab onto anything or anyone.",0,1,0,1,0.0
I watched my mother dive off that same cliff... with a smile on her face.,0,0,0,1,0.0
She didn't even fight.,0,0,0,1,0.0
I know what it's like to lose your mother.,0,0,0,1,0.0
I know you're angry.,1,0,0,0,0.0
This isn't anger.,0,0,0,1,0.0
This is the pain beneath my anger.,0,0,0,1,0.0
It takes courage to fight death.,0,1,0,1,0.0
Maybe it takes more to accept it.,0,0,0,0,0.0
My mum had that same look on her face when she was first diagnosed.,0,0,0,0,0.0
"You're a dead man, too. Aren't you, Barry?",0,0,0,1,0.0
So why don't you fight for yourself?,1,0,0,0,1.0
I'm marking my calendar with the days I have left to live.,0,1,0,1,0.0
And I'm gonna spend them saving as many people as I can.,0,0,1,0,0.0
You're not a coward.,0,0,0,1,0.0
You're just naive.,1,0,0,1,0.0
Mitch Romero's still out there.,0,0,0,0,0.0
You said you wanted to save lives.,0,0,0,0,0.0
Prove it. Help me stop him.,0,0,0,0,0.0
Or get out of my lab.,1,0,0,0,0.0
Let's get to work.,0,0,1,0,0.0
"You know, I don't understand you, Barry.",0,0,0,1,0.0
"You march towards death without fear, just like Mum.",0,0,0,1,0.0
Where is it you get your strength?,0,0,0,0,1.0
Probably the same place she did.,0,0,0,0,0.0
People I love.,0,0,1,0,0.0
I see.,0,0,1,0,0.0
"Well, it must've been incredibly hard to tell them.",0,0,0,1,0.0
"You're a dead man, too.",0,0,0,1,0.0
"Aren't you, Barry?",0,0,0,0,0.0
"Well, it must've been incredibly hard to tell them.",0,0,0,1,0.0
This isn't anger.,0,0,0,0,0.0
This is the pain beneath my anger.,0,0,0,1,0.0
"According to his techno fanny pack, this belongs to Dr. Harrison Nash Wells.",0,0,0,0,0.0
Easy. - We're not gonna hurt you. - No.,0,0,1,0,0.0
Let's just try this again.,0,0,1,0,0.0
"All right, I'm Iris West-Allen.",0,0,0,0,0.0
This is Cisco Ramon. - Iris. Cisco.,0,0,0,0,0.0
And we are friends of the Council of Wells.,0,0,1,0,0.0
"Those idiots. Okay, now.",1,0,0,0,0.0
"Okay, listen, I tased you once before, and I'm happy to do it again, so just...",0,0,1,0,0.0
I let you do that. Now hold still.,0,0,1,0,0.0
What are you doing on our Earth?,0,0,0,0,1.0
What am I doing? I'm searching for an artifact that just happens to contain the same particles...,0,0,0,0,0.0
I'm currently reading off you. - What? - Although...,0,0,0,0,1.0
What--what part-- particles of what?,0,0,0,0,1.0
Eternium.,0,0,0,0,0.0
Eternium?,0,0,0,0,1.0
"Eternium is a Multiversal element, all right?",0,0,0,0,0.0
Although the readings were stronger in the alley.,0,0,0,0,0.0
"Listen, Indiana,",0,0,0,0,0.0
"I don't know how they do things on your Earth, but this ain't Temple of Doom.""""",0,0,0,0,1.0
"And what is Eternium supposed to be, anyway?",0,0,0,0,1.0
Some kind of stolen mystical element from the tiki gods that you suddenly have to return?,0,0,0,0,0.0
"Look, there's no such thing as mystical mumbo jumbo or gods.",0,0,0,0,0.0
"What there are are meta-humans, aliens, and false gods worshiped by simple-minded people that find comfort in myths.",0,0,0,0,0.0
I dispel those myths.,0,0,1,0,0.0
You people are no help.,1,0,0,1,0.0
"Newsflash, Nash.",0,0,0,0,0.0
We've actually done this dance before. - Is that right? - That's right.,0,0,1,0,0.0
"It usually starts off rocky, especially between you and me, but eventually, we bond, and you learn to embrace that sensitive side.",0,0,0,1,0.0
"So why don't you just drop the act, and show me that warm, compassionate, smart guy that I know you to be.",0,0,1,0,0.0
Let me ask you a question.,0,0,0,0,0.0
Do I look like I want to hold hands?,0,0,0,0,1.0
Interesting.,0,0,1,0,0.0
"If you want your toys back, you might just have to.",0,0,0,0,0.0
I have to admit. That was pretty cool.,0,0,1,0,0.0
