content,anger,fear,joy,sadness,surprise
Does she know about the Multiverse?,0,0,0,0,1.0
She kind of does now.,0,0,0,0,0.0
I'll handle it.,0,0,1,0,0.0
"I got the quotes for the mayor story, and I finished your filing. - Everything's alphabetical. - Great.",0,0,1,0,0.0
"Also, I quit.",1,0,0,1,0.0
"Allegra, wait.",0,1,0,0,0.0
You know why I was even out here?,0,0,0,0,0.0
Enjoying the sun.,0,0,1,0,0.0
You don't get much of that in Iron Heights.,0,0,0,0,0.0
"I spent five years locked up there, and it taught me how to tell the difference between a snitch and a liar.",0,0,0,1,0.0
You're not a snitch.,0,0,0,0,0.0
"Allegra, it's not what you think, okay?",0,0,0,1,0.0
Forget it.,0,0,0,0,0.0
I've wasted enough time behind bars.,0,0,0,1,0.0
I'm not wasting any more working for a liar.,1,0,0,1,0.0
"So be honest with me, or I'm out of here.",1,0,0,0,0.0
Okay. You're right.,0,0,1,0,0.0
"I was lying to you, but I can't tell you the truth about Harrison Wells, not yet.",0,0,0,1,0.0
"I do believe in you, Allegra.",0,0,1,0,0.0
"I think you have great instincts, and I think you're gonna make a great reporter.",0,0,1,0,0.0
That's why I took a chance on you.,0,0,0,0,0.0
"Now I'm asking you to take a chance on me, okay?",0,0,0,0,0.0
Trust me.,0,0,0,0,0.0
"When the time is right, I will tell you everything.",0,0,0,0,0.0
I promise.,0,0,0,0,0.0
We're journalists.,0,0,0,0,0.0
"It's our job to tell people the truth, not control it, even if it's tough to say, or hard as hell to hear.",0,0,0,0,0.0
"Just saying, boss.",0,0,0,0,0.0
See you in the morning.,0,0,0,0,0.0
Come to lecture me some more?,1,0,0,0,0.0
"Look, I know you think that you fight better when you're angry, so why don't you try and hit a real target?",0,0,0,0,1.0
"Stop trying to hit me, and hit me.",0,0,0,1,0.0
Or why don't you just admit the truth about what's hurting you?,0,0,0,0,1.0
I don't want to die when I've just started living.,0,1,0,1,0.0
Okay?,0,0,0,0,0.0
"I finally have the chance to live a life, and now this stupid Crisis is gonna take it all away?",1,0,0,1,0.0
I know it's not fair.,0,0,0,1,0.0
Do you know that Baskin-Robbins has 31 different flavors?,0,0,0,0,1.0
I might die before I get to figure out which one is my favorite.,0,1,0,1,0.0
"Or what my favorite song is, or have my first birthday party. 30 years of existing, and I have never had one.",0,0,0,1,0.0
That really sucks.,0,0,0,1,0.0
Frost.,0,0,0,0,0.0
"There's always gonna be a crisis, or some meta-human that's threatening to take away the life that you love.",0,1,0,1,0.0
"Truth is, we're all living on borrowed time.",0,0,0,0,0.0
"So, what, everybody feels this crappy all the time?",0,0,0,0,1.0
That actually does kind of make me feel better.,0,0,1,0,0.0
It's why you can't let the threat of losing tomorrow keep you from making the most of today.,0,0,0,0,0.0
I want to spend the rest of today making sure that Mitch Romero doesn't hurt anyone else.,0,0,0,0,0.0
What are you?,0,0,0,0,1.0
Stop!,0,0,0,0,0.0
Let me go.,0,0,0,0,0.0
Romero!,0,0,0,0,0.0
"Ramsey, don't move.",0,0,0,0,0.0
You want this?,0,0,0,0,1.0
Yeah?,0,0,0,0,1.0
"Yeah, come and get it. Come on.",0,0,1,0,0.0
Come on. Come and get it.,0,0,1,0,0.0
Come on!,0,0,0,0,0.0
"Frost, Romero's heading to the pipeline.",0,0,0,0,0.0
"Hey, there. Come on.",0,0,1,0,0.0
Yeah.,0,0,0,0,0.0
Come on.,0,0,0,0,0.0
"Oh, I miss all the fun.",0,0,0,1,0.0
"Next time we have to lock up an undead meta, he's all yours.",0,0,0,0,0.0
"Uh, Barry.",0,0,0,0,0.0
Guess those meta-cuffs would've been a waste of time.,0,0,0,1,0.0
Dark matter fuels his rage.,0,0,0,0,0.0
"All right, get back.",0,0,1,0,0.0
I'm gonna throw a lightning bolt at him.,1,0,0,0,0.0
"No, no, no, I have a better idea.",0,0,1,0,0.0
Get me all the dark matter in Star Labs. Now.,0,0,0,0,0.0
That's gonna make him stronger.,0,0,1,0,0.0
"No, it's gonna make him angry, and I'm pretty sure if we give it to him, he'll overdose.",0,1,0,0,0.0
Trust me.,0,0,0,0,0.0
"Rage on this, Romero.",0,0,0,0,0.0
You were right.,0,0,0,0,0.0
Anger really does cloud judgment.,0,0,0,0,0.0
"No breaks, just bruising.",0,0,0,1,0.0
You got lucky.,0,0,1,0,0.0
I must be off.,0,0,0,1,0.0
"Ramsey, hey, um...",0,0,0,0,0.0
"I know we didn't see eye to eye today, but thanks for your help.",0,0,1,0,0.0
If you ever want to talk...,0,0,0,0,0.0
"Thanks, but I'm fine.",0,0,1,0,0.0
"See you in the next life, Barry.",0,0,0,1,0.0
"Thanks for coming, Mom.",0,0,1,0,0.0
You kidding?,0,0,0,0,1.0
I'm just so grateful you would see me.,0,0,1,0,0.0
Can I go first?,0,0,0,0,0.0
"When your father left, you came into my room every morning for a week with your hands on your hips, and you said, Where's Dad?""""",0,0,0,1,0.0
And I did not know how to tell you he wasn't coming back.,0,0,0,1,0.0
"I was so worried that you would think it was my fault, or worse, yours.",0,1,0,1,0.0
"And then when I did tell you the truth, you were so mad.",0,0,0,1,0.0
And so hurt.,0,1,0,1,0.0
You could not believe that he left without even saying good-bye.,0,0,0,1,0.0
"So a couple years later when my boyfriend Doug and I broke up, and he left... there was no way I was gonna put you through that pain again.",0,0,0,1,0.0
"You two had become so close, and...",0,0,1,0,0.0
You lied to protect me.,0,0,0,1,0.0
"But, Mom... why did you break up with all the others?",0,0,0,0,1.0
They always wanted more than I could give.,0,0,0,1,0.0
You get scared.,0,0,0,1,0.0
I know because I'm the same way... which is why I made you something.,0,0,0,0,0.0
"An addendum for The Book of Ralph."" ""22 steps to being open to the love of your life.""""",0,0,0,0,0.0
I'm open to love. I'm just picky.,0,0,1,0,0.0
"Mom, give me a break.",0,0,0,0,0.0
Neither one of us have been open to love since Dad left.,0,0,0,1,0.0
"And, Mom, by keeping that pain away... we're also closing ourselves off from the joy that love can bring.",0,0,0,1,0.0
I don't think I'm cut out for joy.,0,0,0,1,0.0
"But I want that joy for you, Ralph.",0,0,1,0,0.0
"Love, happiness, the whole kit and caboodle.",0,0,1,0,0.0
I want you to go find that.,0,0,0,0,0.0
And don't worry about me.,0,0,1,0,0.0
"Okay, Ralph?",0,0,0,0,0.0
"Come on, Mom.",0,0,0,0,0.0
I'll always be your Ralphy.,0,0,1,0,0.0
I now have a new theory.,0,0,1,0,0.0
I believe I have found an effective cure for HLH.,0,0,1,0,0.0
One that would eliminate my need for dark matter entirely.,0,0,0,0,0.0
"Analysis of Subject 1-A, Mitch Romero's blood, reveals that dark matter infused with healthy blood cells to create an even stronger biological substance.",0,0,1,0,0.0
This substance appears to heal any and all weaknesses in the human body... including cells affected by HLH.,0,0,1,0,0.0
I will now commence human trials.,0,0,0,0,0.0
I need more.,0,0,0,0,0.0
What in tarnation?,0,0,0,0,1.0
"Hey, sweetie, we having a little get-together?",0,0,1,0,1.0
"So Frost has never had a birthday party, so I offered to throw her one.",0,0,1,0,0.0
She picked the guest list.,0,0,1,0,0.0
"It's my party, and I'll rage if I want to!",1,0,0,0,0.0
Hey.,0,0,0,0,0.0
You're missing out on all the fun.,0,0,0,1,0.0
Thanks for the party.,0,0,1,0,0.0
"I'm thinking next year, we go whitewater rafting.",0,0,1,0,0.0
You should definitely do that.,0,0,0,0,0.0
"You're not gonna be at my birthday party next year, are you?",0,0,0,1,0.0
"Whenever you talk about life after Crisis, you never talk about yourself.",0,0,0,1,0.0
"You're gonna do more than just vanish in Crisis, aren't you?",0,0,0,0,1.0
I don't know how to tell them.,0,0,0,1,0.0
Try with me by your side.,0,0,1,0,0.0
"Barry, keeping this secret all day hasn't felt right.",0,0,0,1,0.0
Let's tell them together.,0,0,1,0,0.0
"Barry and I didn't share everything that we learned about Crisis, and... you guys deserve to know the truth.",0,0,0,1,0.0
The Monitor didn't just warn us that Crisis was coming early.,0,1,0,0,0.0
There was something else that he said had to happen.,0,0,0,0,0.0
"When I projected my mind forward,",0,0,0,0,0.0
I saw billions of possible futures.,0,0,0,0,0.0
The only timeline where everyone survives... was the one where I died.,0,1,0,1,0.0
I have to die in Crisis.,0,1,0,1,0.0
None of you can try and save me.,0,1,0,1,0.0
18,0,0,0,0,0.0
You are a Cicada.,1,0,0,0,0.0
I don't think I can do it.,0,0,0,1,0.0
I know you can. I believe in you.,0,0,1,0,0.0
We've got Matt Edwards on the ground.,0,0,0,0,1.0
She's a journalist. - Used to be. - Tara Coleman.,0,0,0,0,0.0
I have a daughter. Bring her to the Ecuadoran embassy in Paris.,0,0,1,0,0.0
We don't have much time. They're waking them up. - Waking who up? - Cicadas.,0,1,0,0,0.0
It is starting again. - What's starting again? - Treadstone.,0,0,0,0,1.0
"We did shut down Treadstone, right?",0,0,0,0,1.0
It was bigger than we thought.,0,0,0,0,1.0
Do I know you?,0,0,0,0,1.0
Those memories... they're just...gone.,0,0,0,1,0.0
"You don't know how much I missed you, John.",0,0,1,0,0.0
I can't remember my combination.,0,0,0,1,0.0
"Try zero, nine, zero, nine, 69. ""Fortunate Son"" Release date.",0,0,0,0,1.0
"Ah, you wore that record out in Hanoi.",0,0,0,0,1.0
"Thanks, Frank.",0,0,1,0,0.0
Never got a chance to thank you.,0,0,1,0,0.0
Don't bother.,0,0,1,0,0.0
You would've done the same for me.,0,0,1,0,0.0
"No, don't play it down, John.",1,0,0,0,0.0
"Fact is, you really did it.",0,0,1,0,0.0
"You let them take you, and that gave me enough time to escape.",0,0,1,0,0.0
"Ah, it all worked out in the end.",0,0,1,0,0.0
"Always said if we could make it through the jungles of Vietnam, we could handle anything together. - Well, it's a different kind of jungle now. - Yeah.",0,0,1,0,0.0
You see Matheson out there?,0,0,0,0,1.0
He just got back. Let him get his bearings.,0,0,1,0,0.0
"Hey, man, that's easy for you to say. My partner's still out there.",0,0,1,0,0.0
"I don't know where he is, Pete.",0,0,0,1,0.0
"Hey, come on, give him some space, Wilson.1",0,0,0,0,
"Hey, what did they tell my mother?",0,0,0,0,1.0
Agency protocol.,0,0,0,0,0.0
So she thinks I'm dead?,1,0,0,1,0.0
I was only gone a week.,1,0,0,0,0.0
"John, you were missing for nine months.",1,0,0,1,0.0
How you holding up?,0,0,0,0,1.0
I've lost nine months.,0,0,0,1,0.0
"I have no idea what happened to me during that time, and my mother thinks I'm dead.",0,0,0,1,0.0
"How do you think I'm holding up, Frank? - Yeah, I know you got to be spinning. - Then why'd you ask?",1,0,0,0,1.0
I figured it was a better approach than the awkward silence that happens when two guys don't know what the hell is really going on.,0,0,0,1,0.0
What is going on? - The station chief is gonna have questions--lots of them.,0,0,0,0,1.0
Are you ready to give them answers?,0,0,0,0,1.0
"Yeah, I'll give them everything I can remember.",0,0,1,0,0.0
Like anything they did to you while you were gone.,0,0,1,0,0.0
"Well, I don't remember any details.",0,0,0,1,0.0
"Well, was there anyone that you were connected with, someone that we could identify or leverage?",0,0,0,0,1.0
"It's so nice to see you back, Mr. Bentley.",0,0,1,0,0.0
"It's good to be home, Margie.",0,0,1,0,0.0
Nine months is a long time behind the curtain.,0,1,0,1,0.0
Chief just wants you to tell them what you do remember.,1,0,0,0,0.0
"I'll be right outside, pal.",0,0,1,0,0.0
Dennis Kohler. I'm the new station chief.,0,0,0,0,0.0
"Welcome home, Bentley.",0,0,1,0,0.0
"Thank you, sir.",0,0,1,0,0.0
Sounds like you've been to hell and back.,0,1,0,0,1.0
I speak for everyone in this station when I say we're glad you came home in one piece.,0,0,1,0,0.0
What happened to Morris?,0,0,0,0,1.0
Morris's wife had a baby. He's back in D. C.,0,0,1,0,0.0
"Why don't you start at the beginning, John?",0,0,1,0,0.0
Frank Ferguson and I deployed to Krakow to gather intel on a Soviet control program code-named Tsikada being headed by a former Nazi named Dr. Gustav Meisner. - We were there two weeks. - What did you learn?,0,0,0,0,0.0
Meisner's lab was located inside a Soviet prison on the outskirts of town.,0,0,0,0,0.0
That's where he had an endless supply of subjects.,0,0,0,1,0.0
We were able to confirm that this...,0,0,0,0,0.0
Tsikada program was designed to create human weapons.,1,1,0,0,0.0
Explain that.,0,0,0,0,0.0
They developed a method to strip away a person's identity.,1,0,0,0,0.0
"Employed hypnosis, uh, drugs, electrical stimulation in certain areas of the brain.",1,0,0,0,0.0
To what end?,0,0,0,0,1.0
To make people do things that they would never normally consider.,0,1,0,0,0.0
Ferguson and I received orders to terminate Dr. Meisner and secure all of his research.,0,0,0,0,0.0
Which... didn't go quite as planned.,0,0,0,1,0.0
I was captured.,0,0,0,1,0.0
Ferguson got away.,0,0,0,1,0.0
He claims you sacrificed yourself for him.,0,0,0,1,0.0
"That's not exactly agency policy, but it's admirable.",0,0,1,0,0.0
They tried to break me.,1,0,0,0,0.0
Kept me in isolation... tortured me.... withheld food and water.,0,1,0,1,0.0
"Uh, I was drugged with hallucinogenics.",0,0,0,1,0.0
"I tried to hold on to something, you know?",0,0,0,0,1.0
"My name, my memories.",0,0,0,0,0.0
"Some thoughts of my own, but... it was like trying to grasp water in your hand.",0,0,0,0,0.0
What do you remember?,0,0,0,0,1.0
There was a woman with red hair.,0,0,0,0,0.0
Her name was Petra.,0,0,0,0,0.0
"Somehow, she knew everything about me.",0,1,0,0,0.0
"I tried to fight it, but...",0,0,0,1,0.0
My thoughts... they weren't my own.,0,1,0,0,0.0
And how'd that make you feel?,0,0,0,0,1.0
It's like I was becoming someone more...,0,0,0,0,0.0
More whole. - More... - More what?,0,0,0,0,0.0
Complete.,0,0,0,0,0.0
I finished my mission.,0,0,1,0,0.0
It never occurred to you that they let you finish it?,0,0,0,0,1.0
No.,0,0,0,0,0.0
Small price to pay in exchange for sending one of the CIA's own operatives back as a double agent.,0,0,0,0,0.0
I'm not a traitor.,1,0,0,1,0.0
"I want to order some deeper psych evaluations, keep you under observation for a while.",0,0,0,0,0.0
Prep him for transport.,0,0,0,0,0.0
Cuffs... through the table.,0,0,0,0,0.0
"Talk some sense into him, Ferguson.",1,0,0,0,0.0
What the hell did you just do?,1,0,0,0,0.0
"Sidearm, Frank.",0,0,0,0,0.0
"What now, John?",0,0,0,0,1.0
I'm gonna walk out of here... and I'm gonna prove that I'm telling the truth.,0,0,0,1,0.0
Don't get emotional.,0,0,0,1,0.0
"If someone's bringing it back, we need to stop it.",0,1,0,0,0.0
I know.,0,0,0,0,0.0
So what are you thinking?,0,0,0,0,1.0
Treadstone used someone named Martin Wells.,0,0,0,0,0.0
He was a specialist in behavioral modification.,0,0,0,0,0.0
"Now, if someone's waking up these assets, he might know how it could be done.",0,0,0,0,0.0
Okay.,0,0,0,0,0.0
How far back does this go?,0,0,0,0,1.0
As far as the Cold War.,0,0,0,0,0.0
Hello?,0,0,0,0,0.0
It's Matt Edwards.,0,0,0,0,0.0
What do you want?,0,0,0,0,1.0
I want to know what you're doing.,0,0,0,0,1.0
Right now I'm wondering how you got my number.,0,0,0,0,1.0
"I work for the CIA. Why are you in Paris?  Yeah, I got to go, Matt.  Listen to me.",0,0,0,0,1.0
"Now, I want to know everything Kwon told you about Treadstone.",0,0,0,0,1.0
He told me not to trust the CIA.,0,1,0,0,0.0
"I sent you to talk to him 24 hours ago, and now the person you made contact with is dead, Tara.",0,0,0,1,0.0
You heard everything he said.,0,0,0,0,0.0
I didn't hear what he said after the wire cut out.,0,0,0,0,0.0
You're in Paris.,0,0,0,0,0.0
"Kwon has a daughter in Paris, and we just flagged two North Korean SSD operatives landing at De Gaulle five minutes ago.",0,0,0,0,0.0
"Kwon's daughter is in danger, which means you might be, too.",0,1,0,0,0.0
I can handle myself.,0,0,1,0,0.0
Six men is an extraction unit.,0,0,0,0,0.0
Two men is a kill team.,0,1,0,0,0.0
"Now, I'm gonna ask you one more",0,0,0,0,1.0
Hello?,0,0,0,0,0.0
"Hello, I need to speak to Jang-Mi Kwon. It's urgent. - She's off campus today. - Where'd she go?",0,0,0,0,1.0
It is against school policy to disclose our students' whereabouts.,1,0,0,0,0.0
Mascara is the key.,0,0,0,0,0.0
"And remember, upward strokes are your friend.",0,0,1,0,0.0
Love your scarf.,0,0,1,0,0.0
So... quaint.,0,0,1,0,0.0
First class?,0,0,0,0,1.0
I've been waiting in this dump for you to get back to me about a seat opening in first class.,0,0,1,0,0.0
Or are you just too old and forgot I asked?,1,0,0,0,0.0
"This man has worked at his job for longer than you have been alive, manning his station each day, never questioning his role, performing his duty.",0,0,0,0,0.0
What are you contributing?,0,0,0,0,1.0
Hello?,0,0,0,0,0.0
JangMi?,0,0,0,0,0.0
I need to talk to you about your father.,0,0,0,0,0.0
Who are you?,0,0,0,0,1.0
"Look, I know you don't know me, but we don't have a lot of time.",1,0,0,1,0.0
Let's get out of here.,0,0,1,0,0.0
"Please, just give me a minute.",0,1,0,0,0.0
She doesn't want to talk to you.,0,0,0,1,0.0
It's important.,0,0,0,0,0.0
"If my father wants to talk to me, then he can talk to me himself.",0,0,0,0,0.0
It's not that simple.,0,0,0,1,0.0
It's actually very simple.,0,0,1,0,0.0
Just leave us alone.,1,0,0,0,0.0
"There's something I'm supposed to give to you, JangMi.",0,0,0,0,0.0
I just need five minutes.,0,0,0,0,0.0
How do you know my father?,0,0,0,0,1.0
I used to be a journalist.,0,0,0,0,0.0
"And 24 hours ago, your father asked to meet me.",0,0,0,0,0.0
He asked me to bring you that medallion and take you to someone at the Ecuadoran embassy in Paris.,0,0,0,0,0.0
I'm just gonna call him right now.,0,0,0,0,0.0
"I'm sorry, JangMi. You can't.He's been killed.",0,0,0,1,0.0
And I think the same people who killed him are on their way here for you.,0,1,0,0,0.0
Please trust me.,0,0,0,1,0.0
You didn't tell her you were coming home.,0,0,0,0,0.0
Did you at least tell her Expo fired our asses?,1,0,0,0,0.0
No.,0,0,0,0,0.0
I was hoping the surprise would take the stink off it.,0,0,1,0,0.0
Shit.,1,0,0,0,0.0
"I'll make some calls around town, see if anyone's hiring.",0,0,0,0,0.0
"Man, I wanted a better life for Samantha.",0,0,1,0,0.0
"Go on in there, Romeo.",0,0,0,0,0.0
I will shoot.,1,0,0,0,0.0
"Oh, my God.",0,0,0,0,1.0
Baby.,0,0,1,0,0.0
Baby.,0,0,1,0,0.0
"I thought you were some bandit about to rob me. ""Bandit""?",0,1,0,0,0.0
"Wait, what happened?",0,0,0,0,1.0
Just banged my head.,0,1,0,0,0.0
"Well, you want to go upstairs and I can take a look at it?",0,0,0,0,1.0
Yeah.,0,0,0,0,0.0
You been feeling okay?,0,0,0,0,1.0
The headaches.,0,0,0,1,0.0
I get one every once in a while.,0,0,0,0,0.0
I can talk to some doctors at work and get you some more of those pills.,0,0,0,0,0.0
"No, no more pills, Sam. I can manage.",1,0,0,0,0.0
"Well, if they start getting bad, you need to let me know, Doug.",0,0,0,0,0.0
Promise?,0,0,0,0,1.0
Did something happen out there?,0,0,0,0,1.0
"A bunch of the riggers got laid off. - Me, Mike. - Yeah, I figured.",0,0,0,0,0.0
The company outsourced their jobs.,0,0,0,0,0.0
You need to find a place that just treats you like an actual human being.,1,0,0,0,0.0
I've got that here with you.,0,0,1,0,0.0
Kiss me.,0,0,1,0,0.0
"Now, when I snap my fingers, you will be fully awake, and when you hear me say the word ""poultry,"" you'll become a chicken and do all the things that a chicken does.",0,0,0,0,0.0
"So, Bob, earlier you were telling us how you were a vegetarian.",0,0,0,0,0.0
That's right.,0,0,1,0,0.0
"So you don't eat fish or meat? - No, sir. - Not even chicken... or some other kind of poultry.",0,0,0,0,1.0
"Hey, Tommy, did I forget to tell you?",0,0,0,0,1.0
Happy birthday.,0,0,1,0,0.0
"Thanks, Doc.",0,0,1,0,0.0
It's on the house.,0,0,0,0,0.0
I enjoyed your show.,0,0,1,0,0.0
Is that a Virginia accent I hear?,0,0,0,0,1.0
Or it is a Langley twang?,0,0,0,0,1.0
Treadstone.,0,0,0,0,0.0
It's in the past.,0,0,0,0,0.0
I was on the ground in New York when Blackbriar got blown.,0,0,0,0,0.0
Department of Support?,0,0,0,0,1.0
Special Activities.,0,0,0,0,1.0
What do you know about the people who volunteered for Treadstone?,0,0,0,0,1.0
I know they were dangerous.,0,1,0,0,0.0
That's your first mistake. - How so? - They were more than that.,1,0,0,0,0.0
These are men and women who gave up all their personal power to an institution they assumed was on the right side of things. - Turned out it wasn't. - That's not their fault.,1,0,0,1,0.0
Tell me about what you did for the Cicada program.,0,0,0,0,0.0
"I developed protocols to program candidates who were susceptible to hypnotic triggers a word, a tone, an image.",0,0,0,0,0.0
This type of method was used to wake them up.,0,0,0,0,0.0
And you're saying that actually worked?,0,0,0,0,1.0
"Hey, Tommy, did I forget to tell you? - Happy birthday. - Thanks, Doc.",0,0,1,0,0.0
It's on the house.,0,0,0,0,0.0
Success rate with the assets during their training was above 85%.,0,0,1,0,0.0
Someone's waking them up.,0,0,0,0,0.0
I know.,0,0,0,0,0.0
This is a news story about a psycho who shot up a 7Eleven.,0,1,0,0,0.0
It's not proof that someone's waking up assets.,0,0,0,1,0.0
Look closer. What do you see?,0,0,0,0,1.0
"He runs a smooth, onehanded garment clear and puts six rounds down range in less than a second.",0,0,0,0,0.0
"Impressive attributes, but not enough to warrant our concern, right?",0,0,0,0,1.0
Until we look closer.,0,0,0,0,0.0
Most righthanded shooters shoot left to right.,0,0,0,0,0.0
"Now, this guy goes right, left, center, left.",0,0,0,0,0.0
That's extremely skilled target selection - in a highpressure situation. - Keep going.,0,0,0,0,0.0
"Well, he starts with youngest and most physically fit and saves the oldest for last because he presents the lowest threat level.",1,0,0,0,0.0
And then he turns the page in the blink of an eye.,0,0,0,0,0.0
"No jitters, no adrenaline dump.",0,0,0,0,0.0
Absolutely zero leakage.,0,0,0,0,1.0
"This happened three days ago. - How'd the police catch this guy? - Quite easily this man exited the store and simply sat down on the curb, almost like his mission was complete,",0,0,1,0,1.0
How do you explain that?,0,0,0,0,1.0
"The longer an asset's been sleeping, the more unreliable he might prove to be upon activation.",0,0,0,0,0.0
"I want to talk to this guy, and I want you to come with me.",0,0,0,0,0.0
Let's hope it works this time.,0,1,0,0,0.0
Where do we stand?,0,0,0,0,1.0
Edwards is looking into Kwon's allegations.,0,0,0,0,0.0
What's your take?,0,0,0,0,1.0
"He took a huge risk reaching out to us, and I think once his people found out, they had him killed.",0,1,0,0,0.0
"All right, do we know what he told this - Tara Coleman. - Yeah, about Stiletto Six.",0,0,0,0,0.0
"No, but let's not forget that he did request her for a reason. - Do we know why? - Not yet.",0,0,0,1,0.0
She says that Kwon didn't say anything about it.,0,0,0,0,0.0
You believe her?,0,0,0,0,1.0
I'll keep you updated.,0,0,0,0,0.0
I always knew my father was a target.,0,1,0,1,0.0
A man in his position in my country is always at risk.,0,1,0,1,0.0
I just never thought anything would actually happen to him.,0,1,0,1,0.0
"I didn't get to spend much time with General Kwon, but he was trying to do the right thing.",0,0,1,0,0.0
It doesn't feel real yet.,0,0,0,0,1.0
None of this feels real.,0,0,0,0,0.0
"You're not alone, babe. I'm right here with you.",0,0,1,0,0.0
We've got a problem.,0,0,0,1,0.0
Put on your seat belt. - How far to the embassy? - Still a few more blocks.,0,0,0,0,1.0
Look out!,0,1,0,0,0.0
Brace yourself.,0,0,1,0,0.0
"Oh, fuck.",1,0,0,0,1.0
They're right behind us.,0,0,0,0,0.0
Crap.,1,0,0,0,0.0
Move!,1,0,0,0,0.0
Get out the way!,1,0,0,0,0.0
One more block!,1,0,0,0,0.0
Are they still back there?,0,0,0,0,1.0
Look at me.,0,0,0,0,0.0
"We're gonna make it, okay?",0,0,1,0,0.0
They keep coming from the direction of the border.,0,0,0,0,0.0
Just a constant wave after wave.,0,0,0,0,0.0
This is her.,0,0,0,0,0.0
You know your training. Lock it down.,0,0,0,0,0.0
There's more coming!,1,1,0,0,0.0
There's more coming in!,1,1,0,0,0.0
It's not smart to go to sleep unless it's safe.,0,1,0,0,0.0
No.,0,0,0,0,0.0
It's not.,0,0,0,0,0.0
"Well? ""Well"" What?",1,0,0,0,1.0
Is it safe?,0,0,0,0,0.0
"Michonne, do you copy?",0,0,0,0,0.0
How long till the next wave hits?,0,1,0,0,0.0
"One hour from the north, two from the south.",0,0,0,0,0.0
"Northern wave's thicker than fleas on a farm dog, but the southern's more dispersed.",0,1,0,0,0.0
"By my estimation, we'll be fighting into the night again.",0,1,0,0,0.0
"Yeah, can't push 'em too much further.",0,0,0,0,0.0
I have eyes.,1,0,0,0,0.0
Sorry. I'm just tired.,0,0,0,1,0.0
We all are.,0,0,0,1,0.0
"Hey, heads up.",0,0,0,0,0.0
The north border. Now. - Call off your walkers. - Not us.,0,0,0,0,0.0
"Yeah, right.",0,0,1,0,0.0
Not.,1,0,0,0,0.0
"Go to the border, lay down your weapons, and wait.",0,0,0,0,0.0
Wait for what?,0,0,0,0,1.0
Her.,0,0,0,0,0.0
All right!,0,0,0,0,0.0
Is this your mother?,0,0,0,0,0.0
No.,0,0,0,0,0.0
I don't think it is.,1,0,0,0,0.0
Why's she want to talk with us?,0,0,0,0,1.0
You crossed into her land.,0,0,0,0,0.0
Again. You have to answer for that.,1,0,0,0,0.0
We don't have to do anything.,0,0,0,0,0.0
We could just not go. - That's a bad idea. - We're already under attack.,1,1,0,0,0.0
Yeah! Yeah!,0,0,1,0,0.0
It isn't her.,0,0,0,0,0.0
"If she wanted you dead, she'd send the horde.",1,0,0,0,0.0
"All of it, not just a few waves at a time.",0,1,0,0,0.0
Maybe she's trying to wear us down first.,0,0,0,0,0.0
"Or, as I relayed to you all at the beginning of this meeting, there's plausible reason to believe that the satellite and fire...",0,0,0,0,0.0
"I don't want to hear about the damn satellite anymore, Eugene!",1,0,0,0,0.0
My friends died trying to save yours and ended up with their heads on spikes.,1,0,0,0,0.0
The Highwaymen want justice!,1,0,0,0,0.0
Yeah! Yeah!,0,0,1,0,0.0
